ID,Publication Date,Title EN,Meta Title EN,Meta Desctiption EN,Excerpt EN,Slug EN,Title DE,Meta Title DE,Meta Desctiption DE,Excerpt DE,Slug DE,Title PL,Meta Title PL,Meta Desctiption PL,Excerpt PL,Slug PL,Title RU,Meta Title RU,Meta Desctiption RU,Excerpt RU,Slug RU,Location Lat,Location Long,City,Property Type,Bedrooms,Covered Area,Plot Size,Completion Date,Price,Beach,Restaurants,Shops,Airport,Hospital,School,Center,Golf,Description EN,Description DE,Description PL,Description RU,Preview Image,Images,Developer DE,Developer PL,Developer EN,Developer RU,Video ID,Video Preview,Full Description EN,Full Description DE,Full Description PL,Full Description RU,FAQ EN,FAQ DE,FAQ PL,FAQ RU
skyline-villas-imperio,2026-01-26T10:40Z,Skyline Villas,"Luxury Skyline Villas for Sale in Limassol, Cyprus",Discover Skyline Villas — luxury 3-bedroom homes for sale in Limassol’s hillside community. Eco-smart living with no agent commission.,"Skyline in Limassol offers sustainable houses, villas, and apartments in a gated community. Features include a Club House, pool, gym, smart home tech, and BREEAM certification.",skyline-villas-imperio,Skyline Villas,"Luxus Skyline Villen zum Verkauf in Limassol, Zypern","Skyline Villen – exklusive 3-Zimmer-Villen auf den Hügeln von Limassol. Nachhaltig, sicher und ohne Maklerprovision.","Skyline Villen bieten luxuriöses Wohnen in einer geschlossenen Anlage über Limassol. Hochwertige Ausstattung, Energieeffizienz und provisionsfreier Kauf für Käufer.",skyline-villas-imperio,Skyline Villas,"Luksusowe wille Skyline na sprzedaż w Limassol, Cypr","Skyline Villas — nowoczesne wille z 3 sypialniami w Limassol. Prywatność, zrównoważony design i zakup bez prowizji.","Skyline Villas to zamknięta społeczność na wzgórzach Limassol. Nowoczesne wille 3-sypialniane z prywatnym ogrodem, basenem i inteligentnymi rozwiązaniami — bez prowizji agencyjnej.",skyline-villas-imperio,Skyline Villas,"Элитные виллы Skyline на продажу в Лимассоле, Кипр","Skyline Villas — современные виллы с 3 спальнями в Лимассоле. Без комиссии агентству, с бассейном и энергоэффективными технологиями.","Skyline Villas — это элитный жилой комплекс с виллами на холмах Лимассола. Просторные 3-спальные дома с частным бассейном, террасой и умными системами — без комиссии агентству.",skyline-villas-imperio,34.72491394102163,33.06681949878425,Limassol,Villa,3,194-228,217-742,11-2027,835000,10,5,5,42,4,3,6,22,"Skyline is a premium gated hillside community in Limassol, built for residents who want fresh air, privacy, and quick access to city life. The development is BREEAM-certified and brings together a carefully selected range of properties — 3-bedroom houses and villas, as well as contemporary 1- and 2-bedroom apartments. Although set in a calm elevated setting, Skyline remains close to everything, with central Limassol only minutes away and private schools just 400 m from the entrance.

A dedicated Club House adds everyday lifestyle value, offering a shared swimming pool, a modern gym, a residents’ lounge, and a co-working zone. Homes come with high-spec features such as Wi-Fi smart home readiness, photovoltaic panels, effective thermal insulation, and EV charging preparation. With controlled entry, video intercoms, and communal CCTV, Skyline provides a secure environment and is classified as a Nearly Zero Energy Building — an ideal choice for comfortable and energy-efficient living in Limassol.","Skyline ist eine hochwertige, gesicherte Wohnanlage in den Hügeln von Limassol – perfekt für alle, die Natur, Privatsphäre und die Nähe zur Stadt verbinden möchten. Das BREEAM-zertifizierte Projekt bietet ein attraktives Immobilienangebot: Häuser und Villen mit 3 Schlafzimmern sowie moderne Apartments mit 1 oder 2 Schlafzimmern. Trotz der ruhigen Höhenlage ist das Stadtzentrum in wenigen Minuten erreichbar, und private Schulen liegen nur 400 m entfernt.

Ein Club House mit Gemeinschaftspool, Fitnessstudio, Residents Lounge und Co-Working-Bereich sorgt für zusätzlichen Komfort. Die Ausstattung umfasst Smart-Home-Vorbereitung (Wi-Fi), Photovoltaik, Wärmedämmung und Vorbereitung für E-Auto-Ladestationen. Dank kontrolliertem Zugang, Video-Gegensprechanlagen und CCTV bietet Skyline ein hohes Maß an Sicherheit. Als Nearly Zero Energy Building steht Skyline für modernes, energieeffizientes Wohnen in Limassol.","Skyline to prestiżowe, zamknięte osiedle na wzgórzach Limassol, stworzone dla osób, które chcą mieć więcej spokoju i zieleni, ale nadal pozostać blisko miasta. Inwestycja posiada certyfikat BREEAM i obejmuje różne typy nieruchomości: domy i wille z 3 sypialniami oraz nowoczesne apartamenty z 1 lub 2 sypialniami. Lokalizacja zapewnia ciszę i prywatność, a jednocześnie szybki dojazd do centrum — dodatkowo prywatne szkoły są tylko 400 m od inwestycji.

W Club House dostępny jest basen wspólny, nowoczesna siłownia, lounge dla mieszkańców oraz strefa coworkingowa. Standard obejmuje m.in. przygotowanie pod smart home (Wi-Fi), panele fotowoltaiczne, dobrą izolację termiczną oraz przygotowanie pod ładowarki EV. Bezpieczeństwo zapewnia zamknięty wjazd, wideodomofony i monitoring CCTV. Skyline to energooszczędne osiedle klasy Nearly Zero Energy Building w Limassol.","Skyline — премиальный закрытый комплекс на холмах Лимассола для тех, кто хочет больше тишины, свежего воздуха и приватности, но при этом быть рядом с городской инфраструктурой. Проект с сертификацией BREEAM предлагает разные форматы жилья: виллы и дома с 3 спальнями, а также современные апартаменты с 1–2 спальнями. До центра Лимассола — всего несколько минут, а частные школы находятся всего в 400 метрах.

Инфраструктура комплекса включает Club House с общим бассейном, тренажёрный зал, лаунж для резидентов и зону для работы в формате co-working. В отделке и инженерии предусмотрены решения высокого уровня: подготовка под Wi-Fi smart home, солнечные панели, эффективная теплоизоляция и возможность установки зарядки для электромобилей. Закрытый въезд, видеодомофоны и система CCTV обеспечивают безопасность. Skyline относится к классу Nearly Zero Energy Building и отлично подходит для комфортной и энергоэффективной жизни в Лимассоле.",skyline-villas/00.jpeg,skyline-villas,Imperio Properties,Imperio Properties,Imperio Properties,Imperio Properties,,,,,,,,,,