ID,Publication Date,Title EN,Meta Title EN,Meta Desctiption EN,Excerpt EN,Slug EN,Title DE,Meta Title DE,Meta Desctiption DE,Excerpt DE,Slug DE,Title PL,Meta Title PL,Meta Desctiption PL,Excerpt PL,Slug PL,Title RU,Meta Title RU,Meta Desctiption RU,Excerpt RU,Slug RU,Location Lat,Location Long,City,Property Type,Bedrooms,Covered Area,Plot Size,Completion Date,Price,Beach,Restaurants,Shops,Airport,Hospital,School,Center,Golf,Description EN,Description DE,Description PL,Description RU,Preview Image,Images,Developer DE,Developer PL,Developer EN,Developer RU,Video ID,Video Preview,Full Description EN,Full Description DE,Full Description PL,Full Description RU,FAQ EN,FAQ DE,FAQ PL,FAQ RU
id,publishedAt,title_en,seo_metaTitle_en,seo_metaDescription_en,excerpt_en,slug_en,title_de,seo_metaTitle_de,seo_metaDescription_de,excerpt_de,slug_de,title_pl,seo_metaTitle_pl,seo_metaDescription_pl,excerpt_pl,slug_pl,title_ru,seo_metaTitle_ru,seo_metaDescription_ru,excerpt_ru,slug_ru,location_lat,location_lng,keyFeatures_city,keyFeatures_propertyType,keyFeatures_bedrooms,keyFeatures_coveredArea,keyFeatures_plotSize,completionDate,keyFeatures_price,distances_beach,distances_restaurants,distances_shops,distances_airport,distances_hospital,distances_school,distances_cityCenter,distances_golfCourt,description_en,description_de,description_pl,description_ru,previewImage_path,images_paths,developer_de,developer_pl,developer_en,developer_ru,videoId,videoPreview_path,fullDescription_en,fullDescription_de,fullDescription_pl,fullDescription_ru,faq_en,faq_de,faq_pl,faq_ru
portside-imperio,2026-01-26T10:40Z,Portside,"Luxury Portside Apartments for Sale in Limassol, Cyprus","Discover Portside — modern 1–2 bedroom apartments for sale in Limassol. Gated, sustainable living just 4 mins from the beach. No agent commission.","Portside in Limassol offers sustainable 1 and 2-bedroom apartments in a gated mixed-use complex. Features include a gym, business lounge, rooftop terrace, and BREEAM certification.",portside-imperio,Portside,"Luxus Portside Wohnungen zum Verkauf in Limassol, Zypern","Entdecken Sie Portside – moderne 1–2-Zimmer-Wohnungen in Limassol. Nachhaltig, sicher und nur 4 Min. vom Strand. Ohne Maklerprovision.","Portside bietet stilvolle 1–2-Zimmer-Wohnungen zum Verkauf in Limassol. Ein sicheres, umweltfreundliches Wohnprojekt mit erstklassigen Annehmlichkeiten und provisionsfreiem Kauf.",portside-imperio,Portside,"Luksusowe apartamenty Portside na sprzedaż w Limassol, Cypr","Nowoczesne apartamenty Portside 1–2 sypialnie w Limassol. Blisko morza, energooszczędne, bez prowizji agencyjnej.","Portside to nowoczesny kompleks apartamentów w Limassol, oferujący stylowe mieszkania z 1–2 sypialniami. Zrównoważony design, doskonała lokalizacja i brak prowizji dla kupujących.",portside-imperio,Portside,"Элитные апартаменты Portside на продажу в Лимассоле, Кипр","Современные апартаменты Portside 1–2 спальни в Лимассоле. Закрытый комплекс, 4 мин до моря, без комиссии агентству.","Portside — это новый жилой проект в Лимассоле с 1–2 спальнями. Закрытая территория, устойчивые технологии, высокий комфорт и покупка без комиссии.",portside-imperio,34.66067612795176,33.00984287583049,Limassol,Apartment,1-2,77-142,0,03-2028,268000,4,3,5,45,10,3,6,6,"Portside is a secure, gated mixed-use development in one of Limassol’s best-connected districts — just minutes from the port, marina, and major business areas. Created for modern city living, the project combines premium apartments with adaptable commercial space. It is a BREEAM-certified sustainable development and a Nearly Zero Energy Building, featuring photovoltaic panels, advanced thermal insulation, and high-performance glazing. Safety is reinforced with controlled access, a guardhouse, and communal CCTV.

The residential collection includes smartly planned 1-bedroom apartments and spacious 2-bedroom homes, ideal for professionals and families. Residents enjoy everyday comfort and convenience with a co-working business lounge, a fully equipped gym, and a landscaped rooftop terrace. The complex also offers a children’s playground, provisions for smart home systems, EV charging points, and a video intercom — delivering a balanced lifestyle focused on connectivity, efficiency, and comfort.","Portside ist ein gesichertes, eingezäuntes Mixed-Use-Projekt in einem der am besten angebundenen Stadtteile von Limassol – nur wenige Minuten vom Hafen, der Marina und wichtigen Business-Hotspots entfernt. Das Konzept richtet sich an modernes urbanes Wohnen und verbindet hochwertige Apartments mit flexibel nutzbaren Gewerbeflächen. Die Anlage ist BREEAM-zertifiziert, als Nearly Zero Energy Building eingestuft und verfügt über Photovoltaik, starke Wärmedämmung sowie Hochleistungsverglasung. Für Sicherheit sorgen ein kontrollierter Zugang, ein Wachhaus und gemeinschaftliches CCTV.

Zur Auswahl stehen durchdacht geschnittene 1-Schlafzimmer-Apartments sowie großzügige 2-Schlafzimmer-Wohnungen, ideal für Berufstätige und Familien. Bewohner profitieren von einem Business-Lounge-Bereich für Co-Working, einem voll ausgestatteten Fitnessstudio und einer begrünten Dachterrasse zum Entspannen. Zusätzlich gibt es einen Kinderspielplatz, Smart-Home-Vorbereitung, Ladestationen für E-Autos und eine Video-Gegensprechanlage – eine starke Kombination aus Lage, Nachhaltigkeit und Komfort.","Portside to zamknięta, strzeżona inwestycja typu mixed-use w jednej z najlepiej skomunikowanych części Limassol — kilka minut od portu, mariny i kluczowych stref biznesowych. Projekt został zaprojektowany z myślą o nowoczesnym stylu życia w mieście i łączy komfortowe mieszkania z elastycznymi przestrzeniami komercyjnymi. To inwestycja z certyfikatem BREEAM, sklasyfikowana jako Nearly Zero Energy Building, z panelami fotowoltaicznymi, bardzo dobrą izolacją termiczną i energooszczędnymi przeszkleniami. Bezpieczeństwo zapewniają zamknięty wjazd, ochrona oraz monitoring CCTV.

W ofercie znajdują się funkcjonalne apartamenty z 1 sypialnią oraz przestronne mieszkania z 2 sypialniami — świetne zarówno dla par i osób pracujących, jak i dla rodzin. Mieszkańcy mają do dyspozycji business lounge do pracy i spotkań, w pełni wyposażoną siłownię oraz zielony taras na dachu do relaksu. Dodatkowo przewidziano plac zabaw dla dzieci, przygotowanie pod smart home, ładowarki EV i wideodomofon. Portside to połączenie lokalizacji, efektywności energetycznej i wygody na co dzień.","Portside — закрытый охраняемый комплекс формата mixed-use в одном из самых удобных районов Лимассола: всего в нескольких минутах от порта, марины и ключевых деловых зон. Проект создан для современного городского ритма и объединяет качественные жилые апартаменты с гибкими коммерческими помещениями. Комплекс имеет сертификацию BREEAM, относится к классу Nearly Zero Energy Building и включает солнечные панели, эффективную теплоизоляцию и энергосберегающее остекление. Безопасность обеспечивают закрытый въезд, пост охраны и общая система CCTV.

В проекте представлены функциональные апартаменты с 1 спальней и просторные квартиры с 2 спальнями — отличный выбор для профессионалов и семей. Для комфорта жителей предусмотрены бизнес-лаунж для работы, полностью оборудованный спортзал и озеленённая терраса на крыше для отдыха. Также есть детская площадка, подготовка под smart home, зарядки для электромобилей и видеодомофон. Portside — это баланс локации, энергоэффективности и повседневного удобства.",portside/00.jpeg,portside,Imperio Properties,Imperio Properties,Imperio Properties,Imperio Properties,,,,,,,,,,
silicon-park-imperio,2026-01-26T10:40Z,Silicon Park,"Luxury Silicon Park Apartments for Sale in Limassol, Cyprus","Explore Silicon Park — smart 1–3 bedroom apartments in Limassol’s Mesa Geitonia. Sustainable, secure, and no agency commission.","Silicon Park in Limassol (Mesa Geitonia) is a mixed-use development with offices and apartments. Features include BREEAM certification, a gym, pool, daycare, and co-working spaces.",silicon-park-imperio,Silicon Park,"Luxus Silicon Park Wohnungen zum Verkauf in Limassol, Zypern","Silicon Park – moderne 1–3-Zimmer-Wohnungen in Limassol Mesa Geitonia. Nachhaltig, sicher und ohne Maklerprovision.","Silicon Park kombiniert Wohnen, Arbeiten und Freizeit in einem nachhaltigen Konzept. Moderne 1–3-Zimmer-Wohnungen in Limassol – provisionsfrei und zukunftsorientiert.",silicon-park-imperio,Silicon Park,"Luksusowe apartamenty Silicon Park na sprzedaż w Limassol, Cypr","Silicon Park oferuje nowoczesne 1–3 pokojowe apartamenty w Limassol. Zrównoważony styl życia, nowoczesny design i brak prowizji.","Silicon Park to inteligentny kompleks w Mesa Geitonia, Limassol. Nowoczesne apartamenty 1–3 sypialnie, strefy biznesowe i rekreacyjne – zakup bez prowizji.",silicon-park-imperio,Silicon Park,"Элитные апартаменты Silicon Park на продажу в Лимассоле, Кипр","Современные апартаменты Silicon Park 1–3 спальни в Меса Геитония, Лимассол. Энергоэффективные дома без комиссии агентству.","Silicon Park — инновационный жилой проект в Лимассоле с 1–3 спальнями. Закрытый комплекс с офисами, бассейном и фитнес-зоной. Покупка без комиссии агентству.",silicon-park-imperio,34.705102115451105,33.05325608158505,Limassol,Apartment,1-3,46-142,0,10-2028,215000,10,5,5,42,4,3,6,22,"Silicon Park is a modern mixed-use development in Mesa Geitonia, Limassol, created for people who value smart urban living, comfort, and sustainability. The project includes two office buildings and three serviced residential buildings, combining business infrastructure with high-quality homes. The residential collection features studios and 1, 2, and 3-bedroom apartments, complemented by a private residents’ pool.

On the commercial side, Silicon Park offers strong everyday convenience with spacious co-working zones, a restaurant, a gym, and an on-site daycare centre. Built as a BREEAM-certified and Nearly Zero Energy Building, the development focuses on energy efficiency and future-ready solutions such as smart home provisions, photovoltaic panels, and EV charging stations — a well-balanced choice for modern life in Limassol.","Silicon Park ist ein modernes Mixed-Use-Projekt in Mesa Geitonia, Limassol – ideal für alle, die urbanen Komfort, Innovation und Nachhaltigkeit verbinden möchten. Die Anlage umfasst zwei Bürogebäude sowie drei Serviced-Residential-Gebäude und kombiniert damit Business-Infrastruktur mit hochwertigem Wohnen. Im Wohnbereich stehen Studios sowie Apartments mit 1, 2 oder 3 Schlafzimmern zur Verfügung, ergänzt durch einen privaten Pool für Bewohner.

Der kommerzielle Teil bietet großzügige Co-Working-Flächen, ein Restaurant, ein Fitnessstudio und eine Kinderbetreuung vor Ort. Als BREEAM-zertifiziertes Projekt und Nearly Zero Energy Building setzt Silicon Park auf Energieeffizienz und zukunftssichere Ausstattung wie Smart-Home-Vorbereitung, Photovoltaik und Ladestationen für E-Autos – perfekt für einen modernen Lebensstil in Limassol.","Silicon Park to nowoczesna inwestycja mixed-use w Mesa Geitonia (Limassol), stworzona dla osób, które chcą połączyć miejski styl życia z wygodą i ekologicznym podejściem. Projekt obejmuje dwa budynki biurowe oraz trzy budynki mieszkalne typu serviced, dzięki czemu oferuje świetną równowagę między strefą biznesową a mieszkaniową. Część mieszkalna to studia oraz apartamenty z 1, 2 i 3 sypialniami, a do dyspozycji mieszkańców jest prywatny basen.

Strefa komercyjna zapewnia duże przestrzenie coworkingowe, restaurację, siłownię oraz przedszkole/centrum opieki dziennej. Silicon Park posiada certyfikat BREEAM i jest klasyfikowany jako Nearly Zero Energy Building, oferując m.in. przygotowanie pod smart home, panele fotowoltaiczne i ładowarki EV — idealne rozwiązanie na przyszłość w Limassol.","Silicon Park — современный комплекс mixed-use в районе Mesa Geitonia, Лимассол, созданный для тех, кто ценит баланс между городским комфортом, технологиями и экологичным подходом. Проект включает два офисных здания и три корпуса serviced residence, объединяя развитую деловую инфраструктуру и качественное жильё. В жилой части представлены студии и апартаменты с 1, 2 или 3 спальнями, а также частный бассейн только для резидентов.

Коммерческая инфраструктура включает просторные зоны co-working, ресторан, тренажёрный зал и центр дневного ухода за детьми. Silicon Park имеет сертификацию BREEAM и относится к классу Nearly Zero Energy Building. В комплексе предусмотрены smart home решения, солнечные панели и зарядные станции для электромобилей — практичный и перспективный формат жизни в Лимассоле.",silicon-park/00.jpeg,silicon-park,Imperio Properties,Imperio Properties,Imperio Properties,Imperio Properties,,,,,,,,,,
skyline-apartments-imperio,2026-01-26T10:40Z,Skyline Apartments,"Luxury Skyline Apartments for Sale in Limassol, Cyprus",Discover Skyline — elegant 1–2 bedroom apartments in Limassol’s hillside community. Sustainable living with no agent commission.,"Skyline in Limassol offers sustainable houses, villas, and apartments in a gated community. Features include a Club House, pool, gym, smart home tech, and BREEAM certification.",skyline-apartments-imperio,Skyline Apartments,"Luxus Skyline Wohnungen zum Verkauf in Limassol, Zypern","Skyline – elegante 1–2-Zimmer-Wohnungen auf den Hügeln von Limassol. Nachhaltig, sicher und ohne Maklerprovision.","Skyline bietet moderne 1–2-Zimmer-Wohnungen in einer geschlossenen Anlage über Limassol. Hochwertige Ausstattung, Club House, Fitnessraum – provisionsfrei für Käufer.",skyline-apartments-imperio,Skyline Apartments,"Luksusowe apartamenty Skyline na sprzedaż w Limassol, Cypr","Skyline oferuje nowoczesne apartamenty 1–2 sypialnie w Limassol. Widok na morze, strefa Club House, zakup bez prowizji.","Skyline to elegancki kompleks na wzgórzach Limassol. Apartamenty 1–2 sypialnie z dostępem do basenu, siłowni i lounge. Kupno bez prowizji dla kupującego.",skyline-apartments-imperio,Skyline Apartments,"Элитные апартаменты Skyline на продажу в Лимассоле, Кипр","Современные апартаменты Skyline 1–2 спальни в Лимассоле. Уют, безопасность и покупка без комиссии агентству.","Skyline — элитный жилой комплекс на холмах Лимассола. Просторные апартаменты с 1–2 спальнями, Club House с бассейном и фитнес-залом. Без комиссии агентству.",skyline-apartments-imperio,34.72491394102162,33.06681949878424,Limassol,Apartment,1-2,68-149,0,11-2027,289000,10,5,5,42,4,3,6,22,"Skyline is an elegant gated community set on the hills of Limassol, created for those who want a rare mix of peaceful outdoor living and fast access to the city. This BREEAM-certified development features a selection of well-planned homes — spacious 3-bedroom houses and villas, along with modern 1- and 2-bedroom apartments. Just minutes from central Limassol, residents enjoy privacy and quiet while staying close to shops, restaurants, and business areas. Private schools are located only 400 metres away.

The community is centred around a Club House with a communal swimming pool, a fully equipped gym, a residents’ lounge, and a co-working space. Premium specifications include Wi-Fi smart home provisions, photovoltaic panels, advanced thermal insulation, and EV charging preparation. Security is supported by controlled access, video intercoms, and communal CCTV. Classified as a Nearly Zero Energy Building, Skyline delivers comfort, safety, and sustainable modern living in Limassol.","Skyline ist eine exklusive, eingezäunte Wohnanlage in den Hügeln von Limassol – ideal für alle, die Ruhe im Grünen suchen und gleichzeitig schnell in der Stadt sein möchten. Das BREEAM-zertifizierte Projekt bietet eine durchdachte Auswahl an Immobilien: großzügige Häuser und Villen mit 3 Schlafzimmern sowie moderne Apartments mit 1 oder 2 Schlafzimmern. Nur wenige Minuten vom Zentrum entfernt genießen Bewohner Privatsphäre und Aussicht, während Einkaufsmöglichkeiten, Restaurants und Business-Hubs bequem erreichbar bleiben. Private Schulen befinden sich nur 400 m entfernt.

Ein Club House mit Gemeinschaftspool, Fitnessstudio, Residents Lounge und Co-Working-Bereich sorgt für zusätzlichen Komfort im Alltag. Hochwertige Ausstattung wie Smart-Home-Vorbereitung (Wi-Fi), Photovoltaik, Wärmedämmung und Vorbereitung für E-Auto-Ladestationen macht Skyline zukunftssicher. Ein gesicherter Zugang, Video-Gegensprechanlagen und CCTV erhöhen die Sicherheit. Als Nearly Zero Energy Building steht Skyline für modernes, nachhaltiges Wohnen in Limassol.","Skyline to eleganckie, zamknięte osiedle położone na wzgórzach Limassol — idealne dla osób, które chcą połączyć bliskość natury z wygodą życia w mieście. Inwestycja z certyfikatem BREEAM oferuje przemyślaną gamę nieruchomości: przestronne domy i wille z 3 sypialniami oraz nowoczesne apartamenty z 1 lub 2 sypialniami. Do centrum Limassol jest zaledwie kilka minut, a prywatne szkoły znajdują się tylko 400 m od inwestycji.

Do dyspozycji mieszkańców jest Club House z basenem wspólnym, siłownią, lounge dla mieszkańców oraz strefą coworkingową. Wysoki standard obejmuje m.in. przygotowanie pod smart home (Wi-Fi), panele fotowoltaiczne, skuteczną izolację termiczną oraz przygotowanie pod ładowarki EV. Bezpieczeństwo zapewnia zamknięty wjazd, wideodomofony i monitoring CCTV. Skyline to komfortowe, bezpieczne i energooszczędne osiedle klasy Nearly Zero Energy Building w Limassol.","Skyline — закрытый жилой комплекс на холмах Лимассола, созданный для тех, кто хочет сочетать спокойствие рядом с природой и быстрый доступ к городу. Проект с сертификацией BREEAM предлагает разные форматы жилья: просторные дома и виллы с 3 спальнями, а также современные апартаменты с 1 и 2 спальнями. До центра Лимассола — всего несколько минут, при этом дома остаются в тихой и приватной локации. Частные школы находятся всего в 400 метрах.

Инфраструктура включает Club House с общим бассейном, полностью оборудованный спортзал, лаунж для резидентов и co-working. В проекте предусмотрены высокий стандарт отделки и технологий: Wi-Fi smart home решения, солнечные панели, эффективная теплоизоляция и подготовка под зарядку электромобилей. Безопасность обеспечивает закрытый въезд, видеодомофоны и общая система CCTV. Skyline относится к классу Nearly Zero Energy Building, предлагая комфорт и энергоэффективность в одном из лучших городов Кипра.",skyline-apartments/00.jpeg,skyline-apartments,Imperio Properties,Imperio Properties,Imperio Properties,Imperio Properties,,,,,,,,,,
